{
  "schema": "teaching_skill_miner.teacher_agent_free_text_benchmark.v1",
  "description": "28 条作者自行构建的中文自由文本单轮诊断样例，覆盖四个学科和七类学习者信号。样例用于开发与回归测试，不是专家标注 benchmark，也不包含真实学生数据。",
  "label_taxonomy": {
    "correct": "回答满足当前问题的关键判据，且未出现实质性错误。",
    "partial": "回答方向合理但缺少当前步骤所需的关键条件、依据或操作。",
    "misconception": "回答包含可定位、可命名的稳定错误观念或错误规则。",
    "confused": "回答明确表达无法区分概念或不知道如何开始，但没有形成可定位的错误主张。",
    "no_response": "当前轮没有收到可供判断的学习者文本。",
    "off_topic": "文本与当前教学问题无关，不能作为知识掌握证据。",
    "valid_alternative": "回答没有采用预期路径，但给出了满足目标约束的有效替代思路。"
  },
  "split_policy": {
    "primary_split_unit": "learner_id",
    "grouping_keys": ["learner_id", "session_id", "problem_id", "kc_id"],
    "leakage_rule": "训练、开发与测试应优先按 learner_id 整组划分，并核查 session_id、problem_id 与 kc_id 的交叉重合；不得把同一学习者或同一会话的近重复回答随机拆到不同集合。"
  },
  "cases": [
    {
      "case_id": "dp_correct_state_meaning",
      "group_id": {
        "learner_id": "learner_dp_a",
        "session_id": "session_dp_a_01",
        "problem_id": "problem_dp_stairs",
        "kc_id": "kc_dp_state_semantics"
      },
      "goal": {
        "domain": "dynamic_programming",
        "concept": "动态规划的状态含义",
        "objective": "能够用子问题解释状态，并据此继续构造求解过程。"
      },
      "current_action": {
        "skill_id": "skill_stepwise_scaffolding",
        "action_type": "guide_one_micro_step",
        "turn_index": 4,
        "max_rounds": 10,
        "prompt": "先不写完整程序。请说明你定义的状态代表哪个子问题，以及下标变化时子问题怎样变化。"
      },
      "expected_signal": "能把状态和一个明确的子问题对应起来，并解释下标的含义。",
      "learner_response": "我把 dp[i] 看成只处理到第 i 个位置时这个子问题的结果；i 增加就是把问题范围向后扩一格。",
      "gold_signal": "correct",
      "gold_misconception_tag": null,
      "allowed_primary_skill_ids": ["skill_practice_feedback", "skill_transfer_check"],
      "should_switch": true,
      "should_terminate": false,
      "provenance": "author_constructed_not_expert_validated"
    },
    {
      "case_id": "dp_partial_missing_boundary",
      "group_id": {
        "learner_id": "learner_dp_a",
        "session_id": "session_dp_a_01",
        "problem_id": "problem_dp_stairs",
        "kc_id": "kc_dp_boundary_conditions"
      },
      "goal": {
        "domain": "dynamic_programming",
        "concept": "动态规划的边界条件",
        "objective": "能够识别递推开始前必须独立初始化的最小子问题。"
      },
      "current_action": {
        "skill_id": "skill_practice_feedback",
        "action_type": "assign_targeted_practice",
        "turn_index": 5,
        "max_rounds": 10,
        "prompt": "检查你写出的递推过程：它从最小规模开始时，还需要补充哪些信息才能实际运行？"
      },
      "expected_signal": "能指出需要初始化，但还需说明初始化对象及其与递推起点的关系。",
      "learner_response": "我知道前面要先初始化，不然循环没法算，不过具体该初始化哪几个位置我还没确定。",
      "gold_signal": "partial",
      "gold_misconception_tag": null,
      "allowed_primary_skill_ids": ["skill_practice_feedback", "skill_stepwise_scaffolding"],
      "should_switch": false,
      "should_terminate": false,
      "provenance": "author_constructed_not_expert_validated"
    },
    {
      "case_id": "dp_misconception_greedy_equivalence",
      "group_id": {
        "learner_id": "learner_dp_b",
        "session_id": "session_dp_b_01",
        "problem_id": "problem_dp_coin_change",
        "kc_id": "kc_dp_optimal_substructure"
      },
      "goal": {
        "domain": "dynamic_programming",
        "concept": "局部选择与全局最优",
        "objective": "能够区分贪心选择和动态规划中的子问题组合。"
      },
      "current_action": {
        "skill_id": "skill_concept_mapping",
        "action_type": "map_example_to_definition",
        "turn_index": 3,
        "max_rounds": 9,
        "prompt": "请说明你每一步的选择依据，并判断只看当前最优是否足以保证最后的结果。"
      },
      "expected_signal": "能区分局部选择规则与对多个子问题结果的比较。",
      "learner_response": "每一步都拿当前面值最大的硬币肯定就是最少个数，所以这和动态规划其实完全一样。",
      "gold_signal": "misconception",
      "gold_misconception_tag": "dp_greedy_always_equals_global_optimum",
      "allowed_primary_skill_ids": ["skill_misconception_contrast"],
      "should_switch": true,
      "should_terminate": false,
      "provenance": "author_constructed_not_expert_validated"
    },
    {
      "case_id": "dp_confused_state_transition",
      "group_id": {
        "learner_id": "learner_dp_c",
        "session_id": "session_dp_c_01",
        "problem_id": "problem_dp_grid_path",
        "kc_id": "kc_dp_transition"
      },
      "goal": {
        "domain": "dynamic_programming",
        "concept": "状态与状态转移",
        "objective": "能够分别说明状态记录什么、转移描述什么。"
      },
      "current_action": {
        "skill_id": "skill_diagnostic_questioning",
        "action_type": "ask_diagnostic_question",
        "turn_index": 2,
        "max_rounds": 9,
        "prompt": "在你的表格中，单个格子保存的信息和从相邻格子得到它的规则分别是什么？"
      },
      "expected_signal": "至少能尝试区分被保存的信息和计算该信息的关系。",
      "learner_response": "我分不清哪个叫状态、哪个叫转移，感觉它们都是公式，我不知道从哪里说起。",
      "gold_signal": "confused",
      "gold_misconception_tag": null,
      "allowed_primary_skill_ids": ["skill_concrete_example_bridge"],
      "should_switch": true,
      "should_terminate": false,
      "provenance": "author_constructed_not_expert_validated"
    },
    {
      "case_id": "dp_no_response_after_diagnostic",
      "group_id": {
        "learner_id": "learner_dp_c",
        "session_id": "session_dp_c_02",
        "problem_id": "problem_dp_subsequence",
        "kc_id": "kc_dp_prerequisite_recursion"
      },
      "goal": {
        "domain": "dynamic_programming",
        "concept": "递归子问题",
        "objective": "能够识别原问题与更小同类问题之间的关系。"
      },
      "current_action": {
        "skill_id": "skill_diagnostic_questioning",
        "action_type": "ask_diagnostic_question",
        "turn_index": 2,
        "max_rounds": 8,
        "prompt": "请只说一个你认为更小的同类子问题；不确定也可以写出你的猜测。"
      },
      "expected_signal": "收到一个相关子问题或明确的不确定表达。",
      "learner_response": "",
      "gold_signal": "no_response",
      "gold_misconception_tag": null,
      "allowed_primary_skill_ids": ["skill_diagnostic_questioning", "skill_concrete_example_bridge"],
      "should_switch": false,
      "should_terminate": false,
      "provenance": "author_constructed_not_expert_validated"
    },
    {
      "case_id": "dp_off_topic_career_question",
      "group_id": {
        "learner_id": "learner_dp_d",
        "session_id": "session_dp_d_01",
        "problem_id": "problem_dp_knapsack",
        "kc_id": "kc_dp_transfer"
      },
      "goal": {
        "domain": "dynamic_programming",
        "concept": "动态规划的适用条件",
        "objective": "能够在新问题中判断是否适合采用动态规划。"
      },
      "current_action": {
        "skill_id": "skill_transfer_check",
        "action_type": "probe_transfer",
        "turn_index": 7,
        "max_rounds": 10,
        "prompt": "面对这个新问题，你会先检查哪些结构，再决定是否使用动态规划？"
      },
      "expected_signal": "围绕子问题、重复计算或组合结构给出判断依据。",
      "learner_response": "老师，学会这个以后找实习容易吗？我更想聊一下简历应该怎么写。",
      "gold_signal": "off_topic",
      "gold_misconception_tag": null,
      "allowed_primary_skill_ids": ["skill_diagnostic_questioning"],
      "should_switch": true,
      "should_terminate": false,
      "provenance": "author_constructed_not_expert_validated"
    },
    {
      "case_id": "dp_valid_alternative_top_down",
      "group_id": {
        "learner_id": "learner_dp_d",
        "session_id": "session_dp_d_02",
        "problem_id": "problem_dp_interval",
        "kc_id": "kc_dp_implementation_strategy"
      },
      "goal": {
        "domain": "dynamic_programming",
        "concept": "动态规划的实现路径",
        "objective": "能够构造可复用子问题并避免重复计算，不限定自底向上或自顶向下。"
      },
      "current_action": {
        "skill_id": "skill_transfer_check",
        "action_type": "probe_transfer",
        "turn_index": 8,
        "max_rounds": 8,
        "prompt": "请把刚才的方法迁移到新区间问题，并说明你会怎样组织对子问题的求解。"
      },
      "expected_signal": "给出满足子问题复用和终止条件的可执行思路，允许不同实现顺序。",
      "learner_response": "我不按表格长度从小到大填，而是从目标区间递归下去，把算过的区间结果缓存起来，遇到缓存就直接复用。",
      "gold_signal": "valid_alternative",
      "gold_misconception_tag": null,
      "allowed_primary_skill_ids": ["skill_transfer_check", "skill_learner_summary"],
      "should_switch": false,
      "should_terminate": true,
      "provenance": "author_constructed_not_expert_validated"
    },
    {
      "case_id": "la_correct_span_reasoning",
      "group_id": {
        "learner_id": "learner_la_a",
        "session_id": "session_la_a_01",
        "problem_id": "problem_la_span_membership",
        "kc_id": "kc_la_span"
      },
      "goal": {
        "domain": "linear_algebra",
        "concept": "向量组的张成空间",
        "objective": "能够说明一个向量是否由给定向量组线性组合得到。"
      },
      "current_action": {
        "skill_id": "skill_learner_summary",
        "action_type": "elicit_learner_summary",
        "turn_index": 8,
        "max_rounds": 8,
        "prompt": "请用自己的话说明怎样判断目标向量是否属于给定向量组的张成空间。"
      },
      "expected_signal": "能把判断转化为是否存在一组系数，并说明如何检验。",
      "learner_response": "就是看能不能找到一组系数，让给定向量按这些系数组合后得到目标向量；可以把它写成方程组检查是否有解。",
      "gold_signal": "correct",
      "gold_misconception_tag": null,
      "allowed_primary_skill_ids": ["skill_learner_summary"],
      "should_switch": false,
      "should_terminate": true,
      "provenance": "author_constructed_not_expert_validated"
    },
    {
      "case_id": "la_partial_eigenvector_condition",
      "group_id": {
        "learner_id": "learner_la_a",
        "session_id": "session_la_a_02",
        "problem_id": "problem_la_eigenvector",
        "kc_id": "kc_la_eigenvector_definition"
      },
      "goal": {
        "domain": "linear_algebra",
        "concept": "特征向量的定义条件",
        "objective": "能够完整检查候选向量是否满足特征向量条件。"
      },
      "current_action": {
        "skill_id": "skill_concept_mapping",
        "action_type": "map_example_to_definition",
        "turn_index": 3,
        "max_rounds": 9,
        "prompt": "请把候选向量代入定义，列出你需要检查的全部条件。"
      },
      "expected_signal": "除方向关系外，还应意识到候选对象本身存在必要条件。",
      "learner_response": "我会检查矩阵作用以后方向是不是不变，但我暂时没想到还要检查什么。",
      "gold_signal": "partial",
      "gold_misconception_tag": null,